{
  "version": "0.16.0",
  "generated": "2026-10-11",
  "plays_snapshot": "2026-10-11",
  "method": "Session explorer 2.0 tooling, computed from data/sessions.json (per-session track plays + dates), api/v1/session-clusters.json (era, loudest + deepest-cut tracks, title-credited collaborators, deep-dive + journey links), api/v1/eras.json (era deep-dive links), and api/v1/codex-families.json (key sessions -> family cross-links). Powers session compare, the deepest-sessions editorial ranking, the timeline scrubber, and per-session play profiles on sessions-explorer.html. Play counts are the single 2026-10-11 snapshot; no per-track play trajectory exists in the archive, so none is drawn.",
  "snapshot_history": {
    "available": false,
    "snapshot_count": 1,
    "snapshot_at": "2026-10-11",
    "note": "The archive holds a single play-count snapshot (2026-10-11). Per-track play trajectories over time are not computable from one snapshot - no trend is shown anywhere on the page. Session play profiles are each transmission's lifetime plays in upload order, not a time series."
  },
  "sessions": [
    {
      "id": "session-01",
      "name": "The January 3rd–8th Session",
      "start": "2018-01-03",
      "end": "2018-01-08",
      "days": 6,
      "track_count": 2,
      "total_plays": 13862,
      "avg_plays_per_track": 6931.0,
      "era_id": "the-first-rite",
      "era_name": "The First Rite",
      "era_deep_dive": "eras/the-first-rite.html",
      "loudest": {
        "title": "Soul Shaking (prod. Fish Narc)",
        "plays": 12944,
        "date": "2018-01-03",
        "page": "releases/soul-shaking-prod-fish-narc.html"
      },
      "deepest_cut": {
        "title": "Lucid Boi (prod. $ T.N.C $)",
        "plays": 918,
        "date": "2018-01-08",
        "page": "releases/lucid-boi-prod-t-n-c.html"
      },
      "collaborators": [],
      "deep_dive": null,
      "journey": "transmission.html#era-the-first-rite",
      "play_profile": [
        {
          "title": "Soul Shaking (prod. Fish Narc)",
          "date": "2018-01-03",
          "plays": 12944,
          "page": "releases/soul-shaking-prod-fish-narc.html"
        },
        {
          "title": "Lucid Boi (prod. $ T.N.C $)",
          "date": "2018-01-08",
          "plays": 918,
          "page": "releases/lucid-boi-prod-t-n-c.html"
        }
      ],
      "profile_note": "Play profile: each transmission's lifetime plays in upload order from the single 2026-10-11 snapshot. Not a trajectory - earlier tracks have had longer to accumulate plays, and one snapshot cannot show change over time.",
      "families": [
        {
          "name": "Lucid States",
          "slug": "lucid-states",
          "page": "codex/lucid-states.html",
          "family_transmissions": 1,
          "family_plays": 918
        },
        {
          "name": "Soul",
          "slug": "soul",
          "page": "codex/soul.html",
          "family_transmissions": 1,
          "family_plays": 12944
        }
      ]
    },
    {
      "id": "session-02",
      "name": "The February 4th Session",
      "start": "2018-02-04",
      "end": "2018-02-04",
      "days": 1,
      "track_count": 1,
      "total_plays": 30088,
      "avg_plays_per_track": 30088.0,
      "era_id": "the-first-rite",
      "era_name": "The First Rite",
      "era_deep_dive": "eras/the-first-rite.html",
      "loudest": {
        "title": "Take Me (prod. Em Klebold)",
        "plays": 30088,
        "date": "2018-02-04",
        "page": "releases/take-me-prod-em-klebold.html"
      },
      "deepest_cut": {
        "title": "Take Me (prod. Em Klebold)",
        "plays": 30088,
        "date": "2018-02-04",
        "page": "releases/take-me-prod-em-klebold.html"
      },
      "collaborators": [],
      "deep_dive": null,
      "journey": "transmission.html#era-the-first-rite",
      "play_profile": [
        {
          "title": "Take Me (prod. Em Klebold)",
          "date": "2018-02-04",
          "plays": 30088,
          "page": "releases/take-me-prod-em-klebold.html"
        }
      ],
      "profile_note": "Play profile: each transmission's lifetime plays in upload order from the single 2026-10-11 snapshot. Not a trajectory - earlier tracks have had longer to accumulate plays, and one snapshot cannot show change over time.",
      "families": []
    },
    {
      "id": "session-03",
      "name": "The March 16th Session",
      "start": "2018-03-16",
      "end": "2018-03-16",
      "days": 1,
      "track_count": 1,
      "total_plays": 1008,
      "avg_plays_per_track": 1008.0,
      "era_id": "the-first-rite",
      "era_name": "The First Rite",
      "era_deep_dive": "eras/the-first-rite.html",
      "loudest": {
        "title": "I See U (prod. Haruhi)",
        "plays": 1008,
        "date": "2018-03-16",
        "page": "releases/i-see-u-prod-haruhi.html"
      },
      "deepest_cut": {
        "title": "I See U (prod. Haruhi)",
        "plays": 1008,
        "date": "2018-03-16",
        "page": "releases/i-see-u-prod-haruhi.html"
      },
      "collaborators": [],
      "deep_dive": null,
      "journey": "transmission.html#era-the-first-rite",
      "play_profile": [
        {
          "title": "I See U (prod. Haruhi)",
          "date": "2018-03-16",
          "plays": 1008,
          "page": "releases/i-see-u-prod-haruhi.html"
        }
      ],
      "profile_note": "Play profile: each transmission's lifetime plays in upload order from the single 2026-10-11 snapshot. Not a trajectory - earlier tracks have had longer to accumulate plays, and one snapshot cannot show change over time.",
      "families": []
    },
    {
      "id": "session-04",
      "name": "The April 28th Session",
      "start": "2018-04-28",
      "end": "2018-04-28",
      "days": 1,
      "track_count": 1,
      "total_plays": 1400,
      "avg_plays_per_track": 1400.0,
      "era_id": "the-first-rite",
      "era_name": "The First Rite",
      "era_deep_dive": "eras/the-first-rite.html",
      "loudest": {
        "title": "Mistakes Ft. JO$E DRIPP (prod. Tec)",
        "plays": 1400,
        "date": "2018-04-28",
        "page": "releases/mistakes-ft-jo-e-dripp-prod-tec.html"
      },
      "deepest_cut": {
        "title": "Mistakes Ft. JO$E DRIPP (prod. Tec)",
        "plays": 1400,
        "date": "2018-04-28",
        "page": "releases/mistakes-ft-jo-e-dripp-prod-tec.html"
      },
      "collaborators": [
        "JO$E DRIPP"
      ],
      "deep_dive": null,
      "journey": "transmission.html#era-the-first-rite",
      "play_profile": [
        {
          "title": "Mistakes Ft. JO$E DRIPP (prod. Tec)",
          "date": "2018-04-28",
          "plays": 1400,
          "page": "releases/mistakes-ft-jo-e-dripp-prod-tec.html"
        }
      ],
      "profile_note": "Play profile: each transmission's lifetime plays in upload order from the single 2026-10-11 snapshot. Not a trajectory - earlier tracks have had longer to accumulate plays, and one snapshot cannot show change over time.",
      "families": []
    },
    {
      "id": "session-05",
      "name": "The June 8th–14th Session",
      "start": "2018-06-08",
      "end": "2018-06-14",
      "days": 7,
      "track_count": 2,
      "total_plays": 3030,
      "avg_plays_per_track": 1515.0,
      "era_id": "the-first-rite",
      "era_name": "The First Rite",
      "era_deep_dive": "eras/the-first-rite.html",
      "loudest": {
        "title": "That's a Lie (prod. Xtravulous x WhyLoner)",
        "plays": 1522,
        "date": "2018-06-08",
        "page": "releases/that-s-a-lie-prod-xtravulous-x-whyloner.html"
      },
      "deepest_cut": {
        "title": "Place For Me(prod. Born Hero)",
        "plays": 1508,
        "date": "2018-06-14",
        "page": "releases/place-for-me-prod-born-hero.html"
      },
      "collaborators": [],
      "deep_dive": null,
      "journey": "transmission.html#era-the-first-rite",
      "play_profile": [
        {
          "title": "That's a Lie (prod. Xtravulous x WhyLoner)",
          "date": "2018-06-08",
          "plays": 1522,
          "page": "releases/that-s-a-lie-prod-xtravulous-x-whyloner.html"
        },
        {
          "title": "Place For Me(prod. Born Hero)",
          "date": "2018-06-14",
          "plays": 1508,
          "page": "releases/place-for-me-prod-born-hero.html"
        }
      ],
      "profile_note": "Play profile: each transmission's lifetime plays in upload order from the single 2026-10-11 snapshot. Not a trajectory - earlier tracks have had longer to accumulate plays, and one snapshot cannot show change over time.",
      "families": []
    },
    {
      "id": "session-06",
      "name": "The July 1st Session",
      "start": "2018-07-01",
      "end": "2018-07-01",
      "days": 1,
      "track_count": 1,
      "total_plays": 1282,
      "avg_plays_per_track": 1282.0,
      "era_id": "the-first-rite",
      "era_name": "The First Rite",
      "era_deep_dive": "eras/the-first-rite.html",
      "loudest": {
        "title": "Take Me Back to the City (prod. RainyBaby)",
        "plays": 1282,
        "date": "2018-07-01",
        "page": "releases/take-me-back-to-the-city-prod-rainybaby.html"
      },
      "deepest_cut": {
        "title": "Take Me Back to the City (prod. RainyBaby)",
        "plays": 1282,
        "date": "2018-07-01",
        "page": "releases/take-me-back-to-the-city-prod-rainybaby.html"
      },
      "collaborators": [],
      "deep_dive": null,
      "journey": "transmission.html#era-the-first-rite",
      "play_profile": [
        {
          "title": "Take Me Back to the City (prod. RainyBaby)",
          "date": "2018-07-01",
          "plays": 1282,
          "page": "releases/take-me-back-to-the-city-prod-rainybaby.html"
        }
      ],